{
  "id": "01J00000000000000000000041",
  "seq": 41,
  "type": "pr.merged",
  "time": "2026-10-05T12:01:00Z",
  "projectId": "prj_01",
  "data": {
    "repo": "rluders/orbital-courier",
    "number": 3,
    "action": "merged",
    "branch": "amaru/wi-001-run-state",
    "merged": true,
    "source": "webhook",
    "deliveryId": "d-1"
  },
  "resource": {
    "type": "project",
    "id": "prj_01"
  }
}
